{
  "schema_version": "1.0",
  "project_id": "project.vibehub",
  "generated_at": "2026-07-11T08:00:00.000Z",
  "model_version": "model.fixture.1",
  "freshness": "fresh",
  "completeness": "complete",
  "evidence_refs": [
    {
      "evidence_id": "ev.fixture",
      "kind": "test",
      "grade": "hard_observed",
      "label_key": "evidence.fixture.generated",
      "locator": "fixtures/v3/ev.fixture",
      "captured_at": "2026-07-11T08:00:00.000Z"
    }
  ],
  "warnings": [
    {
      "code": "PATH_CASE_COLLISION",
      "severity": "warning",
      "message_key": "warning.path_case_collision",
      "evidence_refs": [
        {
          "evidence_id": "ev.fixture",
          "kind": "test",
          "grade": "hard_observed",
          "label_key": "evidence.fixture.generated",
          "locator": "fixtures/v3/ev.fixture",
          "captured_at": "2026-07-11T08:00:00.000Z"
        }
      ]
    },
    {
      "code": "PATH_LOCKED",
      "severity": "warning",
      "message_key": "warning.path_locked",
      "evidence_refs": [
        {
          "evidence_id": "ev.fixture",
          "kind": "test",
          "grade": "hard_observed",
          "label_key": "evidence.fixture.generated",
          "locator": "fixtures/v3/ev.fixture",
          "captured_at": "2026-07-11T08:00:00.000Z"
        }
      ]
    },
    {
      "code": "PATH_BUDGET_UNKNOWN",
      "severity": "warning",
      "message_key": "warning.path_budget_unknown",
      "evidence_refs": [
        {
          "evidence_id": "ev.fixture",
          "kind": "test",
          "grade": "hard_observed",
          "label_key": "evidence.fixture.generated",
          "locator": "fixtures/v3/ev.fixture",
          "captured_at": "2026-07-11T08:00:00.000Z"
        }
      ]
    },
    {
      "code": "DIRTY_CLEANUP_REFUSED",
      "severity": "warning",
      "message_key": "warning.dirty_cleanup_refused",
      "evidence_refs": [
        {
          "evidence_id": "ev.fixture",
          "kind": "test",
          "grade": "hard_observed",
          "label_key": "evidence.fixture.generated",
          "locator": "fixtures/v3/ev.fixture",
          "captured_at": "2026-07-11T08:00:00.000Z"
        }
      ]
    }
  ],
  "errors": [],
  "task_id": "task.m0",
  "entry_gate": {
    "state": "closed",
    "m4_gate_digest": null,
    "windows_native_evidence": false,
    "owner_approved": false,
    "self_host_writes_allowed": false,
    "evidence_refs": [
      {
        "evidence_id": "ev.m5.entry-gate",
        "kind": "file",
        "grade": "hard_observed",
        "label_key": "evidence.m5.entryGate",
        "locator": "docs/v3/m4-stability-gate.md",
        "captured_at": "2026-07-11T08:00:00.000Z"
      }
    ]
  },
  "policy": {
    "integration_policy": "merge_no_ff",
    "unknown_scope_decision": "warn",
    "denylist": [
      ".vibehub/state.yaml",
      ".vibehub/events/**",
      "migrations/**",
      "src/v3/contracts/generated/**"
    ],
    "case_sensitive": false,
    "retention_seconds": 86400
  },
  "worktrees": [
    {
      "worktree_id": "worktree.windows",
      "node_id": "node.contracts",
      "session_ids": [
        "session.windows"
      ],
      "display_name": "M0 / contracts",
      "branch": "vibehub/m0/contracts-a1b2c3d",
      "base_sha": "d7ece57",
      "head_sha": "e3a1b90",
      "native_path": {
        "platform": "windows",
        "native": "\\\\?\\C:\\Users\\Alex\\VibeHub",
        "display": "C:/Users/Alex/VibeHub",
        "identity_key": "windows:\\\\?\\C:\\Users\\Alex\\VibeHub",
        "path_kind": "extended",
        "accessible": true
      },
      "state": "repairing",
      "read_only": false,
      "eligibility": {
        "decision": "warn",
        "digest": "dddddddddddddddddddddddddddddddddddddddddddddddddddddddddddddddd",
        "reason_codes": [
          "PATH_BUDGET_UNKNOWN",
          "CASE_COLLISION"
        ],
        "declared_scope": [
          "C:/Repo/Readme.md"
        ],
        "observed_delta": [
          "C:/Repo/README.md"
        ],
        "override": false,
        "evidence_refs": [
          {
            "evidence_id": "ev.worktree.windows.eligibility",
            "kind": "test",
            "grade": "hard_observed",
            "label_key": "evidence.windows.contract",
            "locator": "fixtures/v3/FX-WIN-PATHS",
            "captured_at": "2026-07-11T08:00:00.000Z"
          }
        ]
      },
      "lease": {
        "lease_id": "lease.windows",
        "owner_session_id": "session.windows",
        "owner_host": "macbook-pro",
        "owner_tool": "codex",
        "state": "active",
        "generation": 1,
        "acquired_at": "2026-07-11T08:20:00.000Z",
        "heartbeat_at": "2026-07-11T08:25:00.000Z",
        "expires_at": "2026-07-11T08:35:00.000Z",
        "reclaim_challenge": null,
        "evidence_refs": [
          {
            "evidence_id": "ev.lease.windows",
            "kind": "event",
            "grade": "hard_observed",
            "label_key": "evidence.lease.active",
            "locator": "events/lease.windows",
            "captured_at": "2026-07-11T08:00:00.000Z"
          }
        ]
      },
      "git": {
        "presence": "present",
        "locked": true,
        "dirty": true,
        "detached": false,
        "unborn": false,
        "base_drift": false,
        "changed_files": [
          "README.md"
        ],
        "observed_at": "2026-07-11T08:25:00.000Z",
        "evidence_refs": [
          {
            "evidence_id": "ev.worktree.windows.git",
            "kind": "test",
            "grade": "hard_observed",
            "label_key": "evidence.windows.locked",
            "locator": "fixtures/v3/FX-WIN-PATHS",
            "captured_at": "2026-07-11T08:00:00.000Z"
          }
        ]
      },
      "integration": {
        "operation_id": null,
        "policy": "merge_no_ff",
        "state": "not_requested",
        "queue_position": null,
        "target_branch": "main",
        "evidence_refs": []
      },
      "conflict": null,
      "recovery": {
        "state": "inspect_required",
        "operation_id": "operation.windows.inspect",
        "attempts": 1,
        "last_error": "path_locked",
        "owner_process_state": "unknown",
        "evidence_refs": [
          {
            "evidence_id": "ev.windows.recovery",
            "kind": "test",
            "grade": "hard_observed",
            "label_key": "evidence.windows.recovery",
            "locator": "fixtures/v3/FX-WIN-PATHS",
            "captured_at": "2026-07-11T08:00:00.000Z"
          }
        ]
      },
      "next_action": "Inspect the owning process on a Windows native host; do not remove the dirty worktree",
      "evidence_refs": [
        {
          "evidence_id": "ev.worktree.windows",
          "kind": "event",
          "grade": "hard_observed",
          "label_key": "evidence.worktree.projected",
          "locator": "events/worktree.windows",
          "captured_at": "2026-07-11T08:00:00.000Z"
        }
      ]
    }
  ],
  "integration_queue": [],
  "orphan_candidates": [
    {
      "worktree_id": "worktree.windows",
      "session_id": "session.windows",
      "reason_code": "OWNER_PROCESS_UNKNOWN",
      "process_state": "unknown",
      "inspect_required": true,
      "evidence_refs": [
        {
          "evidence_id": "ev.windows.orphan",
          "kind": "test",
          "grade": "hard_observed",
          "label_key": "evidence.windows.orphan",
          "locator": "fixtures/v3/FX-WIN-PATHS",
          "captured_at": "2026-07-11T08:00:00.000Z"
        }
      ]
    }
  ]
}
