{
  "schema_version": "1.0",
  "project_id": "project.vibehub",
  "generated_at": "2026-07-11T08:00:00.000Z",
  "model_version": "model.fixture.1",
  "freshness": "fresh",
  "completeness": "complete",
  "evidence_refs": [
    {
      "evidence_id": "ev.fixture",
      "kind": "test",
      "grade": "hard_observed",
      "label_key": "evidence.fixture.generated",
      "locator": "fixtures/v3/ev.fixture",
      "captured_at": "2026-07-11T08:00:00.000Z"
    }
  ],
  "warnings": [
    {
      "code": "SCOPE_OVERLAP",
      "severity": "warning",
      "message_key": "warning.scope_overlap",
      "evidence_refs": [
        {
          "evidence_id": "ev.fixture",
          "kind": "test",
          "grade": "hard_observed",
          "label_key": "evidence.fixture.generated",
          "locator": "fixtures/v3/ev.fixture",
          "captured_at": "2026-07-11T08:00:00.000Z"
        }
      ]
    },
    {
      "code": "SCOPE_OVERLAP",
      "severity": "warning",
      "message_key": "warning.scope_overlap",
      "evidence_refs": [
        {
          "evidence_id": "ev.fixture",
          "kind": "test",
          "grade": "hard_observed",
          "label_key": "evidence.fixture.generated",
          "locator": "fixtures/v3/ev.fixture",
          "captured_at": "2026-07-11T08:00:00.000Z"
        }
      ]
    }
  ],
  "errors": [],
  "task_id": "task.m0",
  "entry_gate": {
    "state": "closed",
    "m4_gate_digest": null,
    "windows_native_evidence": false,
    "owner_approved": false,
    "self_host_writes_allowed": false,
    "evidence_refs": [
      {
        "evidence_id": "ev.m5.entry-gate",
        "kind": "file",
        "grade": "hard_observed",
        "label_key": "evidence.m5.entryGate",
        "locator": "docs/v3/m4-stability-gate.md",
        "captured_at": "2026-07-11T08:00:00.000Z"
      }
    ]
  },
  "policy": {
    "integration_policy": "merge_no_ff",
    "unknown_scope_decision": "warn",
    "denylist": [
      ".vibehub/state.yaml",
      ".vibehub/events/**",
      "migrations/**",
      "src/v3/contracts/generated/**"
    ],
    "case_sensitive": true,
    "retention_seconds": 86400
  },
  "worktrees": [
    {
      "worktree_id": "worktree.ui",
      "node_id": "node.ui",
      "session_ids": [
        "session.ui"
      ],
      "display_name": "M1 / project UI",
      "branch": "vibehub/m1/project-ui-3f91a2c",
      "base_sha": "d7ece57",
      "head_sha": "e3a1b90",
      "native_path": {
        "platform": "macos",
        "native": "/Users/alex/.vibehub/worktrees/task-m1/node-ui",
        "display": "/Users/alex/.vibehub/worktrees/task-m1/node-ui",
        "identity_key": "macos:/Users/alex/.vibehub/worktrees/task-m1/node-ui",
        "path_kind": "absolute",
        "accessible": true
      },
      "state": "active",
      "read_only": false,
      "eligibility": {
        "decision": "allow",
        "digest": "bbbbbbbbbbbbbbbbbbbbbbbbbbbbbbbbbbbbbbbbbbbbbbbbbbbbbbbbbbbbbbbb",
        "reason_codes": [],
        "declared_scope": [
          "src/v3/components/project"
        ],
        "observed_delta": [],
        "override": false,
        "evidence_refs": [
          {
            "evidence_id": "ev.worktree.ui.eligibility",
            "kind": "event",
            "grade": "hard_observed",
            "label_key": "evidence.worktree.eligibility",
            "locator": "events/worktree.ui/eligibility",
            "captured_at": "2026-07-11T08:00:00.000Z"
          }
        ]
      },
      "lease": {
        "lease_id": "lease.ui",
        "owner_session_id": "session.ui",
        "owner_host": "macbook-pro",
        "owner_tool": "codex",
        "state": "active",
        "generation": 1,
        "acquired_at": "2026-07-11T08:20:00.000Z",
        "heartbeat_at": "2026-07-11T08:25:00.000Z",
        "expires_at": "2026-07-11T08:35:00.000Z",
        "reclaim_challenge": null,
        "evidence_refs": [
          {
            "evidence_id": "ev.lease.ui",
            "kind": "event",
            "grade": "hard_observed",
            "label_key": "evidence.lease.active",
            "locator": "events/lease.ui",
            "captured_at": "2026-07-11T08:00:00.000Z"
          }
        ]
      },
      "git": {
        "presence": "present",
        "locked": false,
        "dirty": false,
        "detached": false,
        "unborn": false,
        "base_drift": false,
        "changed_files": [],
        "observed_at": "2026-07-11T08:25:00.000Z",
        "evidence_refs": [
          {
            "evidence_id": "ev.worktree.ui.git",
            "kind": "git",
            "grade": "hard_observed",
            "label_key": "evidence.worktree.git",
            "locator": "git/worktree.ui",
            "captured_at": "2026-07-11T08:00:00.000Z"
          }
        ]
      },
      "integration": {
        "operation_id": null,
        "policy": "merge_no_ff",
        "state": "not_requested",
        "queue_position": null,
        "target_branch": "main",
        "evidence_refs": []
      },
      "conflict": null,
      "recovery": {
        "state": "none",
        "operation_id": null,
        "attempts": 0,
        "last_error": null,
        "owner_process_state": "alive",
        "evidence_refs": []
      },
      "next_action": "Continue the assigned node",
      "evidence_refs": [
        {
          "evidence_id": "ev.worktree.ui",
          "kind": "event",
          "grade": "hard_observed",
          "label_key": "evidence.worktree.projected",
          "locator": "events/worktree.ui",
          "captured_at": "2026-07-11T08:00:00.000Z"
        }
      ]
    },
    {
      "worktree_id": "worktree.shared",
      "node_id": "node.shared",
      "session_ids": [
        "session.types"
      ],
      "display_name": "M1 / shared types",
      "branch": "vibehub/m1/shared-types-905c2be",
      "base_sha": "d7ece57",
      "head_sha": "e3a1b90",
      "native_path": {
        "platform": "macos",
        "native": "/Users/alex/.vibehub/worktrees/task-m1/node-shared",
        "display": "/Users/alex/.vibehub/worktrees/task-m1/node-shared",
        "identity_key": "macos:/Users/alex/.vibehub/worktrees/task-m1/node-shared",
        "path_kind": "absolute",
        "accessible": true
      },
      "state": "planned",
      "read_only": false,
      "eligibility": {
        "decision": "block",
        "digest": "cccccccccccccccccccccccccccccccccccccccccccccccccccccccccccccccc",
        "reason_codes": [
          "SCOPE_OVERLAP",
          "GENERATED_ENTRYPOINT"
        ],
        "declared_scope": [
          "src/v3/contracts"
        ],
        "observed_delta": [
          "src/v3/contracts/generated/index.ts"
        ],
        "override": false,
        "evidence_refs": [
          {
            "evidence_id": "ev.worktree.shared.eligibility",
            "kind": "event",
            "grade": "hard_observed",
            "label_key": "evidence.worktree.blocked",
            "locator": "events/worktree.shared/eligibility",
            "captured_at": "2026-07-11T08:00:00.000Z"
          }
        ]
      },
      "lease": null,
      "git": {
        "presence": "present",
        "locked": false,
        "dirty": false,
        "detached": false,
        "unborn": false,
        "base_drift": false,
        "changed_files": [],
        "observed_at": "2026-07-11T08:25:00.000Z",
        "evidence_refs": [
          {
            "evidence_id": "ev.worktree.shared.git",
            "kind": "git",
            "grade": "hard_observed",
            "label_key": "evidence.worktree.git",
            "locator": "git/worktree.shared",
            "captured_at": "2026-07-11T08:00:00.000Z"
          }
        ]
      },
      "integration": {
        "operation_id": null,
        "policy": "merge_no_ff",
        "state": "not_requested",
        "queue_position": null,
        "target_branch": "main",
        "evidence_refs": []
      },
      "conflict": null,
      "recovery": {
        "state": "blocked",
        "operation_id": null,
        "attempts": 0,
        "last_error": "eligibility_blocked",
        "owner_process_state": "not_applicable",
        "evidence_refs": []
      },
      "next_action": "Resolve scope overlap or record an owner override with evidence",
      "evidence_refs": [
        {
          "evidence_id": "ev.worktree.shared",
          "kind": "event",
          "grade": "hard_observed",
          "label_key": "evidence.worktree.projected",
          "locator": "events/worktree.shared",
          "captured_at": "2026-07-11T08:00:00.000Z"
        }
      ]
    }
  ],
  "integration_queue": [],
  "orphan_candidates": []
}
